root@lamp-ubuntu-s-1vcpu-1gb-tor1-01:~# tcpdump -c 5 -i eth0
tcpdump: verbose output suppressed, use -v[v]... for full protocol decode
listening on eth0, link-type EN10MB (Ethernet), snapshot length 262144 bytes
20:08:28.428497 IP lamp-ubuntu-s-1vcpu-1gb-tor1-01.ssh > 162.243.190.66.42748: Flags [P.], seq 3274149244:3274149372, ack 2048145545, win 501, options [nop,nop,TS val 329057740 ecr 795127296], length 128
20:08:28.428587 IP lamp-ubuntu-s-1vcpu-1gb-tor1-01.ssh > 162.243.190.66.42748: Flags [P.], seq 128:192, ack 1, win 501, options [nop,nop,TS val 329057740 ecr 795127296], length 64
20:08:28.428700 IP lamp-ubuntu-s-1vcpu-1gb-tor1-01.ssh > 162.243.190.66.42748: Flags [P.], seq 192:272, ack 1, win 501, options [nop,nop,TS val 329057740 ecr 795127296], length 80
20:08:28.428739 IP lamp-ubuntu-s-1vcpu-1gb-tor1-01.ssh > 162.243.190.66.42748: Flags [P.], seq 272:352, ack 1, win 501, options [nop,nop,TS val 329057740 ecr 795127296], length 80
20:08:28.428773 IP lamp-ubuntu-s-1vcpu-1gb-tor1-01.ssh > 162.243.190.66.42748: Flags [P.], seq 352:432, ack 1, win 501, options [nop,nop,TS val 329057740 ecr 795127296], length 80
5 packets captured
49 packets received by filter
0 packets dropped by kernel
