root@lamp-ubuntu-s-1vcpu-1gb-tor1-01:~# tcpdump -i eth0 tcp
tcpdump: verbose output suppressed, use -v[v]... for full protocol decode
listening on eth0, link-type EN10MB (Ethernet), snapshot length 262144 bytes
20:27:15.592599 IP lamp-ubuntu-s-1vcpu-1gb-tor1-01.ssh > 162.243.190.66.42748: Flags [P.], seq 3276837644:3276837772, ack 2048169561, win 501, options [nop,nop,TS val 330184904 ecr 796254465], length 128
20:27:15.592655 IP lamp-ubuntu-s-1vcpu-1gb-tor1-01.ssh > 162.243.190.66.42748: Flags [P.], seq 128:192, ack 1, win 501, options [nop,nop,TS val 330184904 ecr 796254465], length 64
20:27:15.592693 IP lamp-ubuntu-s-1vcpu-1gb-tor1-01.ssh > 162.243.190.66.42748: Flags [P.], seq 192:272, ack 1, win 501, options [nop,nop,TS val 330184904 ecr 796254465], length 80
20:27:15.592727 IP lamp-ubuntu-s-1vcpu-1gb-tor1-01.ssh > 162.243.190.66.42748: Flags [P.], seq 272:352, ack 1, win 501, options [nop,nop,TS val 330184904 ecr 796254465], length 80
20:27:15.592760 IP lamp-ubuntu-s-1vcpu-1gb-tor1-01.ssh > 162.243.190.66.42748: Flags [P.], seq 352:432, ack 1, win 501, options [nop,nop,TS val 330184904 ecr 796254465], length 80
20:27:15.592789 IP lamp-ubuntu-s-1vcpu-1gb-tor1-01.ssh > 162.243.190.66.42748: Flags [P.], seq 432:496, ack 1, win 501, options [nop,nop,TS val 330184904 ecr 796254465], length 64
20:27:15.592915 IP 162.243.190.66.42748 > lamp-ubuntu-s-1vcpu-1gb-tor1-01.ssh: Flags [.], ack 128, win 7437, options [nop,nop,TS val 796254470 ecr 330184904], length 0
20:27:15.593139 IP 162.243.190.66.42748 > lamp-ubuntu-s-1vcpu-1gb-tor1-01.ssh: Flags [.], ack 192, win 7437, options [nop,nop,TS val 796254470 ecr 330184904], length 0
20:27:15.593139 IP 162.243.190.66.42748 > lamp-ubuntu-s-1vcpu-1gb-tor1-01.ssh: Flags [.], ack 272, win 7437, options [nop,nop,TS val 796254470 ecr 330184904], length 0
20:27:15.593139 IP 162.243.190.66.42748 > lamp-ubuntu-s-1vcpu-1gb-tor1-01.ssh: Flags [.], ack 352, win 7437, options [nop,nop,TS val 796254470 ecr 330184904], length 0
20:27:15.593139 IP 162.243.190.66.42748 > lamp-ubuntu-s-1vcpu-1gb-tor1-01.ssh: Flags [.], ack 432, win 7437, options [nop,nop,TS val 796254470 ecr 330184904], length 0
20:27:15.593157 IP 162.243.190.66.42748 > lamp-ubuntu-s-1vcpu-1gb-tor1-01.ssh: Flags [.], ack 496, win 7437, options [nop,nop,TS val 796254470 ecr 330184904], length 0
20:27:15.692402 IP lamp-ubuntu-s-1vcpu-1gb-tor1-01.42844 > 67.207.67.2.domain: Flags [S], seq 3658618621, win 64240, options [mss 1460,sackOK,TS val 3937017132 ecr 0,nop,wscale 7,tfo  cookiereq,nop,nop], length 0
^C
138 packets captured
209 packets received by filter
0 packets dropped by kernel
