root@lamp-ubuntu-s-1vcpu-1gb-tor1-01:~# tcpdump -i eth0
tcpdump: verbose output suppressed, use -v[v]... for full protocol decode
listening on eth0, link-type EN10MB (Ethernet), snapshot length 262144 bytes
20:07:54.227038 IP lamp-ubuntu-s-1vcpu-1gb-tor1-01.ssh > 162.243.190.66.42748: Flags [P.], seq 3274143436:3274143564, ack 2048144521, win 501, options [nop,nop,TS val 329023538 ecr 795093091], length 128
20:07:54.227122 IP lamp-ubuntu-s-1vcpu-1gb-tor1-01.ssh > 162.243.190.66.42748: Flags [P.], seq 128:192, ack 1, win 501, options [nop,nop,TS val 329023538 ecr 795093091], length 64
20:07:54.227353 IP 162.243.190.66.42748 > lamp-ubuntu-s-1vcpu-1gb-tor1-01.ssh: Flags [.], ack 128, win 7428, options [nop,nop,TS val 795093098 ecr 329023538], length 0
20:07:54.227399 IP 162.243.190.66.42748 > lamp-ubuntu-s-1vcpu-1gb-tor1-01.ssh: Flags [.], ack 192, win 7428, options [nop,nop,TS val 795093098 ecr 329023538], length 0
20:07:54.227495 IP lamp-ubuntu-s-1vcpu-1gb-tor1-01.ssh > 162.243.190.66.42748: Flags [P.], seq 192:272, ack 1, win 501, options [nop,nop,TS val 329023539 ecr 795093098], length 80
20:07:54.227555 IP lamp-ubuntu-s-1vcpu-1gb-tor1-01.ssh > 162.243.190.66.42748: Flags [P.], seq 272:352, ack 1, win 501, options [nop,nop,TS val 329023539 ecr 795093098], length 80
20:07:54.227606 IP lamp-ubuntu-s-1vcpu-1gb-tor1-01.ssh > 162.243.190.66.42748: Flags [P.], seq 352:432, ack 1, win 501, options [nop,nop,TS val 329023539 ecr 795093098], length 80
20:07:54.227657 IP lamp-ubuntu-s-1vcpu-1gb-tor1-01.ssh > 162.243.190.66.42748: Flags [P.], seq 432:496, ack 1, win 501, options [nop,nop,TS val 329023539 ecr 795093098], length 64
20:07:54.227792 IP 162.243.190.66.42748 > lamp-ubuntu-s-1vcpu-1gb-tor1-01.ssh: Flags [.], ack 272, win 7428, options [nop,nop,TS val 795093099 ecr 329023539], length 0
20:07:54.227827 IP 162.243.190.66.42748 > lamp-ubuntu-s-1vcpu-1gb-tor1-01.ssh: Flags [.], ack 352, win 7428, options [nop,nop,TS val 795093099 ecr 329023539], length 0
20:07:54.227827 IP 162.243.190.66.42748 > lamp-ubuntu-s-1vcpu-1gb-tor1-01.ssh: Flags [.], ack 432, win 7428, options [nop,nop,TS val 795093099 ecr 329023539], length 0
20:07:54.227904 IP 162.243.190.66.42748 > lamp-ubuntu-s-1vcpu-1gb-tor1-01.ssh: Flags [.], ack 496, win 7428, options [nop,nop,TS val 795093099 ecr 329023539], length 0
^C
12 packets captured
70 packets received by filter
0 packets dropped by kernel
